{
  "snapshot_id": "missing-file-snapshot-001",
  "version": "v1",
  "commit_sha": "7826feb",
  "environment": "local_preview",
  "generated_at": "2026-05-11T10:12:00Z",
  "artifact_hashes": [
    "sha256:bbbbbbbbbbbbbbbbbbbbbbbbbbbbbbbbbbbbbbbbbbbbbbbbbbbbbbbbbbbbbbbb"
  ],
  "comparison_baseline": null
}
