{
  "snapshot_id": "snapshot.hr-pack-001",
  "version": "preview-v1",
  "commit_sha": "27a2696",
  "environment": "local_preview",
  "generated_at": "2026-05-10T00:45:00Z",
  "artifact_hashes": [
    "sha256:aaaaaaaaaaaaaaaaaaaaaaaaaaaaaaaaaaaaaaaaaaaaaaaaaaaaaaaaaaaaaaaa"
  ],
  "comparison_baseline": "baseline.hr-preview-001"
}
